{
  "$schema": "https://json-schema.org/draft/2020-12/schema",
  "$id": "https://kurone-kito.github.io/idd-skill/schemas/stalled-session-quiet-check.schema.json",
  "title": "Stalled Session Quiet Check",
  "description": "CLI contract for quiet-window evidence collection (Resume/S2 stalled-session recovery)",
  "type": "object",
  "required": [
    "repository",
    "pr",
    "policy",
    "quiet_window_met",
    "quiet_window_ms",
    "window_start",
    "now",
    "latest_activity",
    "latest_activity_type",
    "reason",
    "evidence"
  ],
  "properties": {
    "repository": {
      "type": "object",
      "description": "Repository context used for quiet-window evidence collection.",
      "required": [
        "owner",
        "repo"
      ],
      "properties": {
        "owner": {
          "type": "string",
          "description": "Repository owner used for helper collection"
        },
        "repo": {
          "type": "string",
          "description": "Repository name used for helper collection"
        }
      },
      "additionalProperties": false
    },
    "pr": {
      "type": "object",
      "description": "Pull request context whose activity is evaluated for a stalled-session quiet window.",
      "required": [
        "number",
        "title",
        "head_sha",
        "html_url"
      ],
      "properties": {
        "number": {
          "type": "integer",
          "minimum": 1,
          "description": "Pull request number evaluated by the helper"
        },
        "title": {
          "type": "string",
          "description": "Current PR title"
        },
        "head_sha": {
          "type": "string",
          "description": "Current PR head SHA"
        },
        "html_url": {
          "type": "string",
          "format": "uri",
          "description": "Canonical PR URL"
        }
      },
      "additionalProperties": false
    },
    "policy": {
      "type": "object",
      "description": "Policy inputs used for this quiet-window evaluation.",
      "required": [
        "quiet_window_ms",
        "claim_created_at"
      ],
      "properties": {
        "quiet_window_ms": {
          "type": "integer",
          "minimum": 1,
          "description": "Quiet-window duration used for this evaluation"
        },
        "claim_created_at": {
          "type": [
            "string",
            "null"
          ],
          "pattern": "^(\\d{4}-\\d{2}-\\d{2}T\\d{2}:\\d{2}:\\d{2}Z)?$",
          "description": "Trusted active-claim heartbeat timestamp passed to the helper, or null"
        }
      },
      "additionalProperties": false
    },
    "quiet_window_met": {
      "type": "boolean",
      "description": "Whether the quiet window is satisfied"
    },
    "quiet_window_ms": {
      "type": "integer",
      "minimum": 1,
      "description": "Quiet-window duration used for the evaluation"
    },
    "window_start": {
      "type": "string",
      "pattern": "^\\d{4}-\\d{2}-\\d{2}T\\d{2}:\\d{2}:\\d{2}Z$",
      "description": "Inclusive lower bound for timestamped activity checks"
    },
    "now": {
      "type": "string",
      "pattern": "^\\d{4}-\\d{2}-\\d{2}T\\d{2}:\\d{2}:\\d{2}Z$",
      "description": "Reference timestamp used for the evaluation"
    },
    "latest_activity": {
      "type": [
        "string",
        "null"
      ],
      "pattern": "^(\\d{4}-\\d{2}-\\d{2}T\\d{2}:\\d{2}:\\d{2}Z)?$",
      "description": "Most recent blocking activity timestamp, or null when none were observed"
    },
    "latest_activity_type": {
      "type": [
        "string",
        "null"
      ],
      "description": "Activity type for latest_activity, or null when none were observed"
    },
    "reason": {
      "type": "string",
      "description": "Stable summary of the quiet-window outcome"
    },
    "evidence": {
      "type": "object",
      "description": "Activity evidence supporting the quiet-window result.",
      "required": [
        "activity_count_in_window",
        "blocking_activities",
        "has_heartbeat_in_window",
        "has_ci_running",
        "has_branch_tip_movement"
      ],
      "properties": {
        "activity_count_in_window": {
          "type": "integer",
          "minimum": 0,
          "description": "Number of blocking activities that broke the quiet window"
        },
        "blocking_activities": {
          "type": "array",
          "description": "Blocking activity records considered by the helper",
          "items": {
            "type": "object",
            "required": [
              "type",
              "timestamp"
            ],
            "properties": {
              "type": {
                "type": "string",
                "description": "Observed activity type"
              },
              "timestamp": {
                "type": [
                  "string",
                  "null"
                ],
                "pattern": "^(\\d{4}-\\d{2}-\\d{2}T\\d{2}:\\d{2}:\\d{2}Z)?$",
                "description": "Activity timestamp, or null for timestamp-less ci-running inputs"
              }
            },
            "additionalProperties": false
          }
        },
        "has_heartbeat_in_window": {
          "type": "boolean",
          "description": "Whether a trusted active-claim heartbeat was observed in the quiet window"
        },
        "has_ci_running": {
          "type": "boolean",
          "description": "Whether running or queued CI was observed"
        },
        "has_branch_tip_movement": {
          "type": "boolean",
          "description": "Whether branch-tip movement was observed in the quiet window"
        }
      },
      "additionalProperties": false
    }
  },
  "additionalProperties": false
}
